{
  "schemaVersion": 1,
  "id": "manual-peer-missing",
  "title": "Manual payment target peer missing",
  "description": "A manual payment intent cannot proceed because the target peer is disconnected.",
  "input": {
    "intent": {
      "kind": "manual",
      "amount": "100000000",
      "assetId": "CKB",
      "targetPubkey": "0xpeer"
    }
  },
  "expected": {
    "diagnostics": ["PEER_NOT_CONNECTED"]
  }
}
